<?xml version="1.0" encoding="ISO-8859-1"?>
<!DOCTYPE planning SYSTEM "workspace/despe/WEB-INF/planningConf.dtd">

<planning>
	<month number="11">
		<day number="14">
			<morning correctorNumber="20" meetingDuration="20" ravelNumber="10">
				<beginingHour>
					<Hour hour="8" min="0" />
				</beginingHour>
				<endHour>
					<Hour hour="10" min="0" />
				</endHour>
			</morning>
			<afternoon correctorNumber="20" meetingDuration="20" ravelNumber="10">
<beginingHour><Hour hour="2" min="0" /></beginingHour>
<endHour><Hour hour="3" min="0" /></endHour>
</afternoon>
</day><day number="15">
<morning correctorNumber="20" meetingDuration="20" ravelNumber="10">
<beginingHour><Hour hour="8" min="0" /></beginingHour>
<endHour><Hour hour="10" min="0" /></endHour>
</morning><afternoon correctorNumber="20" meetingDuration="20" ravelNumber="10">
<beginingHour><Hour hour="2" min="0" /></beginingHour>
<endHour><Hour hour="3" min="0" /></endHour>
</afternoon>
</day></month></planning>